{
  "$schema": "https://json-schema.org/draft/2020-12/schema",
  "$id": "https://delpi.local/schemas/delpi.manifest.schema.json",
  "title": "DELPI Plugin Manifest",
  "type": "object",
  "additionalProperties": false,

  "required": [
    "schemaVersion",
    "id",
    "name",
    "version",
    "type",
    "basePath",
    "permissions"
  ],

  "properties": {

    "schemaVersion": {
      "type": "string",
      "const": "1.0.0"
    },

    "id": {
      "type": "string",
      "minLength": 1,
      "maxLength": 50,
      "pattern": "^[a-z0-9-]+$"
    },

    "name": {
      "type": "string",
      "minLength": 1,
      "maxLength": 150
    },

    "description": { "type": "string" },

    "category": { "type": "string" },

    "version": {
      "type": "string",
      "pattern": "^(\\d+)\\.(\\d+)\\.(\\d+)(-[0-9A-Za-z.-]+)?$"
    },

    "icon": { "type": "string" },

    "type": {
      "type": "string",
      "enum": ["microfrontend", "iframe", "backend-only"]
    },

    "basePath": {
      "type": "string",
      "pattern": "^/[-a-z0-9/]*$"
    },

    "entry": {
      "type": ["string", "null"]
    },

    "healthcheck": { "type": "string" },

    "dependencies": {
      "type": "array",
      "items": { "type": "string" }
    },

    "permissions": {
      "type": "array",
      "minItems": 1,
      "items": {
        "type": "object",
        "additionalProperties": false,
        "required": ["code", "name", "module"],
        "properties": {
          "code": {
            "type": "string",
            "minLength": 3,
            "maxLength": 150
          },
          "name": {
            "type": "string",
            "minLength": 1,
            "maxLength": 150
          },
          "description": { "type": "string" },
          "module": {
            "type": "string",
            "minLength": 1,
            "maxLength": 100
          }
        }
      }
    },

    "routes": {
      "type": "array",
      "items": {
        "type": "object",
        "additionalProperties": false,
        "required": ["path", "label", "permission"],
        "properties": {

          "path": {
            "type": "string",
            "minLength": 1,
            "maxLength": 200
          },

          "label": {
            "type": "string",
            "minLength": 1,
            "maxLength": 150
          },

          "icon": { "type": "string" },

          "entry": {
            "type": ["string", "null"],
            "description": "Optional override for plugin entry when this route is opened"
          },

          "permission": {
            "type": "string",
            "minLength": 3,
            "maxLength": 150
          },

          "showInMenu": { "type": "boolean" },

          "openInNewTab": {
            "type": "boolean",
            "description": "When true, menu opens this route in a new browser tab (Entry http(s) or portal path)"
          },

          "order": {
            "type": "integer",
            "minimum": 0
          },

          "menuGroup": { "type": "string" }
        }
      }
    },

    "backend": {
      "type": "object",
      "additionalProperties": false,
      "required": ["required", "validateJwt"],
      "properties": {
        "required": { "type": "boolean" },
        "serviceName": { "type": "string" },
        "baseUrl": { "type": "string" },
        "validateJwt": { "type": "boolean" },
        "audience": { "type": "string" },
        "issuer": { "type": "string" },
        "requiredPermissionsHeader": { "type": "string" }
      }
    },

    "features": { "type": "object" },
    "lifecycle": { "type": "object" },
    "security": { "type": "object" },
    "observability": { "type": "object" },
    "ui": {
      "type": "object",
      "additionalProperties": false,
      "properties": {
        "renderMode": {
          "type": "string",
          "enum": ["embedded", "external", "federated"]
        }
      }
    },
    "metadata": { "type": "object" }
  },

  "oneOf": [

    {
      "title": "Microfrontend Manifest",
      "properties": {
        "type": { "const": "microfrontend" },
        "entry": { "type": "string", "minLength": 1 },
        "routes": { "type": "array", "minItems": 1 }
      },
      "required": ["entry", "routes"]
    },

    {
      "title": "Iframe Manifest",
      "properties": {
        "type": { "const": "iframe" },
        "entry": { "type": "string", "minLength": 1 },
        "routes": { "type": "array", "minItems": 1 }
      },
      "required": ["entry", "routes"]
    },

    {
      "title": "Backend-only Manifest",
      "properties": {
        "type": { "const": "backend-only" },
        "entry": { "type": ["null"] },
        "routes": { "type": "array", "maxItems": 0 }
      },
      "required": ["backend"]
    }

  ],

  "allOf": [
    {
      "if": {
        "properties": { "type": { "const": "iframe" } }
      },
      "then": {
        "properties": {
          "ui": {
            "properties": {
              "renderMode": {
                "enum": ["embedded", "external"]
              }
            }
          }
        }
      }
    },
    {
      "if": {
        "properties": { "type": { "const": "microfrontend" } }
      },
      "then": {
        "properties": {
          "ui": {
            "properties": {
              "renderMode": {
                "enum": ["embedded", "federated"]
              }
            }
          }
        }
      }
    },
    {
      "if": {
        "properties": { "type": { "const": "backend-only" } }
      },
      "then": {
        "properties": {
          "ui": false
        }
      }
    }
  ]
}