{
  "schemaVersion": "1.0.0",
  "id": "api-delpi-console",
  "name": "Console API DELPI",
  "description": "Documentação interativa, explorador OpenAPI, testes HTTP e inspeção de respostas da api-delpi",
  "icon": "terminal",
  "version": "0.1.0",
  "type": "microfrontend",
  "basePath": "/apps/api-delpi-console",
  "entry": "/apps/api-delpi-console/assets/remoteEntry.js",
  "permissions": [
    {
      "code": "api-delpi-console.view",
      "name": "Acesso ao console da API DELPI",
      "description": "Permite explorar rotas, testar endpoints e inspecionar envelopes de resposta",
      "module": "api-delpi-console"
    }
  ],
  "routes": [
    {
      "path": "/apps/api-delpi-console",
      "label": "Console API DELPI",
      "permission": "api-delpi-console.view",
      "icon": "terminal",
      "order": 90,
      "showInMenu": true
    }
  ],
  "ui": {
    "renderMode": "federated"
  }
}
