{
  "schemaVersion": "1.0.0",
  "id": "delia",
  "name": "DÉLIA",
  "description": "Shell standalone de inteligência operacional da DÉLIA (fundação C1). Capacidades de negócio entram em tarefas posteriores.",
  "icon": "radar",
  "version": "0.0.3",
  "type": "microfrontend",
  "basePath": "/apps/delia",
  "entry": "/apps/delia/assets/remoteEntry.js",
  "permissions": [
    {
      "code": "delia.access",
      "name": "Acessar DÉLIA",
      "description": "Acesso de visibilidade ao shell DÉLIA e rota raiz /apps/delia (Product Master APPROVED C1-T4D1). Metadata de aplicação/plataforma — não autoriza Domain AuthZ, Evidence, Decision, Work, PREPARE, ACT, provider/tool ou OT.",
      "module": "delia"
    }
  ],
  "routes": [
    {
      "path": "/apps/delia",
      "label": "DÉLIA",
      "permission": "delia.access",
      "icon": "radar",
      "order": 35,
      "showInMenu": true
    }
  ],
  "backend": {
    "required": true,
    "serviceName": "delia-api",
    "baseUrl": "/apps/delia-api",
    "validateJwt": true
  },
  "ui": {
    "renderMode": "federated"
  },
  "metadata": {
    "owner": "DELPI",
    "product": "DÉLIA",
    "c1Note": "Product Master APPROVED (C1-T4D1): delia.access is the canonical bootstrap/platform-access permission for DÉLIA shell visibility and root route /apps/delia. It does not authorize Domain/Evidence/Decision/Work/PREPARE/ACT/provider/OT operations. Owner=Core RBAC registry. Core live registration and RBAC assignment remain PENDING."
  }
}
