{
  "schemaVersion": "1.0.0",
  "id": "api-delpi-docs",
  "name": "API DELPI Docs",
  "description": "Documentação Swagger da API DELPI",
  "icon": "book-open",
  "version": "1.0.0",
  "type": "iframe",
  "basePath": "/api-delpi-docs",
  "entry": "http://localhost/apps/api-delpi/docs",
  "permissions": [
    {
      "code": "api-delpi-docs.view",
      "name": "Visualizar Docs",
      "description": "Visualizar Docs API DELPI",
      "module": "api-delpi-docs"
    }
  ],
  "routes": [
    {
      "path": "/api-delpi-docs",
      "label": "API DELPI Docs",
      "permission": "api-delpi-docs.view",
      "icon": "book-open",
      "entry": null,
      "order": 10,
      "showInMenu": true
    }
  ],
  "ui": {
    "renderMode": "embedded"
  }
}