{
  "schemaVersion": "1.0.0",
  "id": "supplies",
  "name": "Portal Suprimentos",
  "description": "Hub operacional e analítico de Suprimentos.",
  "icon": "package-icon",
  "version": "0.5.2",
  "type": "microfrontend",
  "basePath": "/apps/supplies",
  "entry": "/apps/supplies/assets/remoteEntry.js",
  "permissions": [
    {
      "code": "supplies.access",
      "name": "Usar Portal Suprimentos",
      "description": "Uso normal do Portal Suprimentos nas unidades operacionais. Não inclui administração.",
      "module": "supplies"
    },
    {
      "code": "supplies.manage",
      "name": "Administrar Portal Suprimentos",
      "description": "Equipe, acessos e configurações do Portal. Não concede uso normal.",
      "module": "supplies"
    }
  ],
  "routes": [
    {
      "path": "/apps/supplies",
      "label": "Portal Suprimentos",
      "permission": "supplies.access",
      "icon": "package-icon",
      "order": 30,
      "showInMenu": true
    },
    {
      "path": "/apps/supplies/overview",
      "label": "Visão geral",
      "permission": "supplies.access",
      "icon": "bar-chart-2",
      "order": 31,
      "showInMenu": false
    },
    {
      "path": "/apps/supplies/my-tasks",
      "label": "Minhas tarefas",
      "permission": "supplies.access",
      "icon": "clipboard-list",
      "order": 32,
      "showInMenu": false
    },
    {
      "path": "/apps/supplies/purchase-requests",
      "label": "Solicitações de compras",
      "permission": "supplies.access",
      "icon": "shopping-cart",
      "order": 33,
      "showInMenu": false
    },
    {
      "path": "/apps/supplies/purchase-orders",
      "label": "Pedidos de compra",
      "permission": "supplies.access",
      "icon": "package",
      "order": 34,
      "showInMenu": false
    },
    {
      "path": "/apps/supplies/deliveries",
      "label": "Entregas",
      "permission": "supplies.access",
      "icon": "truck",
      "order": 35,
      "showInMenu": false
    },
    {
      "path": "/apps/supplies/suppliers",
      "label": "Fornecedores",
      "permission": "supplies.access",
      "icon": "building-2",
      "order": 36,
      "showInMenu": false
    },
    {
      "path": "/apps/supplies/products",
      "label": "Produtos",
      "permission": "supplies.access",
      "icon": "boxes",
      "order": 37,
      "showInMenu": false
    },
    {
      "path": "/apps/supplies/inventory",
      "label": "Estoque",
      "permission": "supplies.access",
      "icon": "warehouse",
      "order": 38,
      "showInMenu": false
    },
    {
      "path": "/apps/supplies/safety-stock",
      "label": "Estoque de segurança",
      "permission": "supplies.access",
      "icon": "shield",
      "order": 39,
      "showInMenu": false
    },
    {
      "path": "/apps/supplies/consumption-audit",
      "label": "Auditoria de consumo",
      "permission": "supplies.access",
      "icon": "search-check",
      "order": 40,
      "showInMenu": false
    },
    {
      "path": "/apps/supplies/negotiations",
      "label": "Negociações",
      "permission": "supplies.access",
      "icon": "handshake",
      "order": 41,
      "showInMenu": false
    },
    {
      "path": "/apps/supplies/indicators",
      "label": "Indicadores",
      "permission": "supplies.access",
      "icon": "gauge",
      "order": 42,
      "showInMenu": false
    },
    {
      "path": "/apps/supplies/market-intelligence",
      "label": "Inteligência de Mercado",
      "permission": "supplies.access",
      "icon": "trending-up",
      "order": 43,
      "showInMenu": false
    },
    {
      "path": "/apps/supplies/administration",
      "label": "Administração",
      "permission": "supplies.manage",
      "icon": "settings",
      "order": 44,
      "showInMenu": false
    },
    {
      "path": "/apps/supplies/help",
      "label": "Ajuda",
      "permission": "supplies.access",
      "icon": "circle-help",
      "order": 45,
      "showInMenu": false
    }
  ],
  "backend": {
    "required": true,
    "serviceName": "supplies-api",
    "baseUrl": "/apps/supplies-api",
    "validateJwt": true
  },
  "ui": {
    "renderMode": "federated"
  }
}
