{
  "schemaVersion": "1.0.0",
  "id": "strategic-indicators",
  "name": "DELPI Indicadores",
  "description": "Painel estratégico corporativo com IGD, IDDs, tendências e alertas.",
  "icon": "activity",
  "version": "1.1.0",
  "type": "microfrontend",
  "basePath": "/apps/strategic-indicators",
  "entry": "/apps/strategic-indicators/assets/remoteEntry.js",
  "permissions": [
    {
      "code": "strategic-indicators.view",
      "name": "Acessar painel estratégico",
      "description": "Permite acessar a visão executiva do painel estratégico.",
      "module": "strategic-indicators"
    },
    {
      "code": "strategic-indicators.departments.view",
      "name": "Visualizar departamentos",
      "description": "Permite acessar a visão comparativa dos departamentos.",
      "module": "strategic-indicators"
    },
    {
      "code": "strategic-indicators.indicators.view",
      "name": "Visualizar indicadores",
      "description": "Permite acessar a visão analítica dos indicadores.",
      "module": "strategic-indicators"
    },
    {
      "code": "strategic-indicators.trends.view",
      "name": "Visualizar tendências",
      "description": "Permite acessar a visão histórica e temporal.",
      "module": "strategic-indicators"
    },
    {
      "code": "strategic-indicators.alerts.view",
      "name": "Visualizar alertas",
      "description": "Permite acessar a visão de alertas e priorizações.",
      "module": "strategic-indicators"
    },
    {
      "code": "strategic-indicators.presentation.view",
      "name": "Visualizar modo apresentação",
      "description": "Permite acessar o modo apresentação do painel.",
      "module": "strategic-indicators"
    },
    {
      "code": "strategic-indicators.settings.manage",
      "name": "Gerenciar configurações do painel",
      "description": "Permite alterar pesos, metas e parâmetros do painel.",
      "module": "strategic-indicators"
    }
  ],
  "routes": [
    {
      "path": "/apps/strategic-indicators",
      "label": "Painel Estratégico",
      "permission": "strategic-indicators.view",
      "icon": "bar-chart3",
      "entry": null,
      "order": 10,
      "showInMenu": true
    },
    {
      "path": "/apps/strategic-indicators/departments",
      "label": "Departamentos",
      "permission": "strategic-indicators.departments.view",
      "icon": "building2",
      "entry": null,
      "order": 11,
      "showInMenu": true
    },
    {
      "path": "/apps/strategic-indicators/indicators",
      "label": "Indicadores",
      "permission": "strategic-indicators.indicators.view",
      "icon": "table-properties",
      "entry": null,
      "order": 12,
      "showInMenu": true
    },
    {
      "path": "/apps/strategic-indicators/trends",
      "label": "Tendências",
      "permission": "strategic-indicators.trends.view",
      "icon": "line-chart",
      "entry": null,
      "order": 13,
      "showInMenu": true
    },
    {
      "path": "/apps/strategic-indicators/alerts",
      "label": "Alertas",
      "permission": "strategic-indicators.alerts.view",
      "icon": "triangle-alert",
      "entry": null,
      "order": 14,
      "showInMenu": true
    },
    {
      "path": "/apps/strategic-indicators/presentation",
      "label": "Modo Apresentação",
      "permission": "strategic-indicators.presentation.view",
      "icon": "presentation",
      "entry": null,
      "order": 15,
      "showInMenu": false
    },
    {
      "path": "/apps/strategic-indicators/settings",
      "label": "Configurações",
      "permission": "strategic-indicators.settings.manage",
      "icon": "settings",
      "entry": null,
      "order": 16,
      "showInMenu": false
    },
    {
      "path": "/apps/strategic-indicators/departments/financial",
      "label": "Financeiro",
      "permission": "strategic-indicators.departments.view",
      "icon": "landmark-icon",
      "entry": null,
      "order": 111,
      "showInMenu": false
    },
    {
      "path": "/apps/strategic-indicators/departments/hr",
      "label": "RH",
      "permission": "strategic-indicators.departments.view",
      "icon": "file-user",
      "entry": null,
      "order": 112,
      "showInMenu": false
    },
    {
      "path": "/apps/strategic-indicators/departments/commercial",
      "label": "Comercial",
      "permission": "strategic-indicators.departments.view",
      "icon": "hand-coins",
      "entry": null,
      "order": 113,
      "showInMenu": false
    },
    {
      "path": "/apps/strategic-indicators/departments/production",
      "label": "Produção",
      "permission": "strategic-indicators.departments.view",
      "icon": "factory-icon",
      "entry": null,
      "order": 114,
      "showInMenu": false
    },
    {
      "path": "/apps/strategic-indicators/departments/quality",
      "label": "Qualidade",
      "permission": "strategic-indicators.departments.view",
      "icon": "award",
      "entry": null,
      "order": 115,
      "showInMenu": false
    },
    {
      "path": "/apps/strategic-indicators/departments/supplies",
      "label": "Suprimentos",
      "permission": "strategic-indicators.departments.view",
      "icon": "boxes",
      "entry": null,
      "order": 116,
      "showInMenu": false
    },
    {
      "path": "/apps/strategic-indicators/departments/engineering",
      "label": "Engenharia",
      "permission": "strategic-indicators.departments.view",
      "icon": "hard-hat",
      "entry": null,
      "order": 117,
      "showInMenu": false
    }
  ],
  "backend": {
    "audience": "delpi-central",
    "baseUrl": "/apps/strategic-indicators-api/strategic-indicators",
    "issuer": "https://www.minhadelpi.com.br/auth",
    "required": true,
    "serviceName": "strategic-indicators-api",
    "validateJwt": true
  },
  "ui": {
    "renderMode": "federated"
  }
}